Nomenclatura,Título,Fecha de publicación,Documento,URL Documento,Cantidad de páginas,Tipo documento
RESOLUCIÓN N° 321,"DICTAMEN 51-99 DE CUMPLIMIENTO POR PARTE DEL GOBIERNO DE PERU RESPECTO DE OBLIGACIONES DERIVADAS DE LA RESOLUCION 431 DE LA JUNTA DEL ACUERDO DE CARTAGENA, QUE ESTABLECE LOS REQUISITOS FITOSANITARIOS APLICABLES  AL COMERCIO DE PRODUCTOS AGRICOLAS.",19/11/1999,RESo321.doc,https://www.comunidadandina.org/DocOficialesFiles/resoluciones/RESo321.doc,3,Resoluciones
RESOLUCIÓN N° 323,SUSTITUCION DE LAS RESOLUCIONES 336 Y 442 DE LA JUNTA DEL ACUERDO DE CARTAGENA SOBRE REQUISITOS ESPECIFICOS DE ORIGEN PARA PRODUCTOS DEL SECTOR AUTOMOTOR.,26/11/1999,RESo323.doc,https://www.comunidadandina.org/DocOficialesFiles/resoluciones/RESo323.doc,12,Resoluciones
RESOLUCIÓN N° 325,DICTAMEN 53-99 DE INCUMPLIMIENTO POR PARTE DEL GOBIERNO DE VENEZUELA AL NO OBSERVAR LO DISPUESTO EN LA RESOLUCION 278 DE LA SECRETARIA GENERAL DE LA COMUNIDAD ANDINA.,30/11/1999,RESo325.doc,https://www.comunidadandina.org/DocOficialesFiles/resoluciones/RESo325.doc,3,Resoluciones
RESOLUCIÓN N° 324,"SOLICITUD DE LA EMPRESA SINTESIS QUIMICA S.A. (SINQUISA) DEL PERU, PARA LA APLICACIÓN DE DERECHOS COMPENSATORIOS A LAS IMPORTACIONES DE BOLIVIA, COLOMBIA, ECUADOR Y VENEZUELA DE ALGUNOS PRODUCTOS FARMACEUTICOS COMPRENDIDOS EN LAS SUBPARTIDAS NANDINA 2941.10.10, 2941.10.20 Y 2941.10.30, ORIGINARIOS O PROVENIENTES DE LA INDIA.",30/11/1999,RESo324.doc,https://www.comunidadandina.org/DocOficialesFiles/resoluciones/RESo324.doc,13,Resoluciones
RESOLUCIÓN N° 326,"PRECIOS DE REFERENCIA DEL SISTEMA ANDINO DE FRANJAS DE PRECIOS PARA LA SEGUNDA QUINCENA DE DICIEMBRE DE 1999, CORRESPONDIENTES A LA CIRCULAR Nº 114 DEL 03 DE DICIEMBRE DE 1999.",3/12/1999,RESo326.doc,https://www.comunidadandina.org/DocOficialesFiles/resoluciones/RESo326.doc,3,Resoluciones
RESOLUCIÓN N° 328,PRECIOS PISO Y TECHO Y TABLAS ADUANERAS DEL SISTEMA ANDINO DE FRANJAS DE PRECIOS PARA EL PERIODO ABRIL DEL 2000 - MARZO DEL 2001.,13/12/1999,RESo328.doc,https://www.comunidadandina.org/DocOficialesFiles/resoluciones/RESo328.doc,3,Resoluciones
RESOLUCIÓN N° 327,"REGLAMENTO DE APLICACIÓN DE LA DECISION 283, EN LO RELATIVO AL CALCULO DE LA CUANTIA DEL SUBSIDIO SUJETO A DERECHOS COMPENSATORIOS.",13/12/1999,RESo327.doc,https://www.comunidadandina.org/DocOficialesFiles/resoluciones/RESo327.doc,4,Resoluciones
RESOLUCIÓN N° 331,DICTAMEN 55-99 DE INCUMPLIMIENTO POR PARTE DEL GOBIERNO DE BOLIVIA AL EXIGIR LA CONSULARIZACIÓN DE LOS CERTIFICADOS SANITARIOS PARA EL COMERCIO AGROPECUARIO DE LOS PRODUCTOS PROVENIENTES DE LOS DEMÁS PAÍSES MIEMBROS DE LA COMUNIDAD ANDINA.,16/12/1999,RESo331.doc,https://www.comunidadandina.org/DocOficialesFiles/resoluciones/RESo331.doc,4,Resoluciones
RESOLUCIÓN N° 330,DICTAMEN 54-99 DE CUMPLIMIENTO POR PARTE DEL GOBIERNO DE ECUADOR POR OTORGAMIENTO DE PERMISO DE PRESTACION DE SERVICIOS DE TRANSPORTE INTERNACIONAL DE MERCANCIAS POR CARRETERA.,16/12/1999,RESo330.doc,https://www.comunidadandina.org/DocOficialesFiles/resoluciones/RESo330.doc,3,Resoluciones
RESOLUCIÓN N° 329,"POR LA CUAL SE RESUELVE EL RECURSO DE RECONSIDERACION PRESENTADO POR EL GOBIERNO DE COLOMBIA CONTRA LA RESOLUCION 291 DE LA SECRETARIA GENERAL DE LA COMUNIDAD ANDINA, QUE CONTIENE EL DICTAMEN 39-99 DE INCUMPLIMIENTO.",16/12/1999,RESo329.doc,https://www.comunidadandina.org/DocOficialesFiles/resoluciones/RESo329.doc,14,Resoluciones
DECISIÓN N° 473,MODIFICACIÓN DE LAS DECISIONES 439 Y 463 EN RELACIÓN CON LOS PLAZOS ESTABLECIDOS PARA LA ELABORACIÓN DE INVENTARIOS.,17/12/1999,dec473.doc,https://www.comunidadandina.org/DocOficialesFiles/decisiones/dec473.doc,3,Decisiones
RESOLUCIÓN N° 333,MODIFICACION DE LA RESOLUCION 419 SOBRE EL INVENTARIO SUBREGIONAL DE PLAGAS Y ENFERMEDADES DE LOS VEGETALES.,20/12/1999,RESo333.doc,https://www.comunidadandina.org/DocOficialesFiles/resoluciones/RESo333.doc,2,Resoluciones
RESOLUCIÓN N° 332,"PRECIOS DE REFERENCIA DEL SISTEMA ANDINO DE FRANJAS DE PRECIOS PARA LA PRIMERA QUINCENA DE ENERO DEL 2000, CORRESPONDIENTES A LA CIRCULAR N° 115 DEL 17 DE DICIEMBRE DE 1999.",20/12/1999,RESo332.doc,https://www.comunidadandina.org/DocOficialesFiles/resoluciones/RESo332.doc,3,Resoluciones
